{
  "taskId": "task-2026-10-10-002",
  "capabilityRequirement": { "capabilityId": "pdf.convert", "revision": "r1" },
  "providerConstraints": {
    "trustedProvenanceRequired": true,
    "supportedPlatform": "WINDOWS"
  },
  "lifecyclePolicy": { "retention": "JIT_REMOVE_AFTER_VERIFIED_USE" },
  "targetTask": {
    "fixtureRef": "fixture://pdf-convert/sample-invoice",
    "parameters": { "outputFormat": "PDF/A" }
  },
  "preExistingUserAssets": [
    { "path": "C:\\fixtures\\user-assets\\notes.txt" }
  ]
}
